{
  "schema_version": "wave-mvp-gate-evidence.v1",
  "gate_id": "harden-contract-driven-wave-mvp-4.1-2026-08-05T03",
  "openspec_tasks": [
    {
      "task_id": "1.1",
      "status": "verified",
      "owned_files": [
        "contracts/wave_mvp_scenario_matrix.json"
      ]
    },
    {
      "task_id": "1.2",
      "status": "verified",
      "owned_files": [
        "schemas/wave-mvp-completion.schema.json",
        "scripts/validate_wave_mvp_completion.py"
      ]
    },
    {
      "task_id": "2.1",
      "status": "verified",
      "owned_files": [
        "scripts/run_joint_wave_surface_mvp.py",
        "tests/test_joint_wave_surface_mvp.py",
        "tests/test_wave_contract_hardening.py"
      ]
    },
    {
      "task_id": "2.2",
      "status": "verified",
      "owned_files": [
        "tests/test_joint_wave_surface_mvp.py"
      ]
    },
    {
      "task_id": "2.3",
      "status": "verified",
      "owned_files": [
        "tests/test_wave_contract_hardening.py"
      ]
    },
    {
      "task_id": "3.1",
      "status": "verified",
      "owned_files": [
        "scripts/run_joint_wave_surface_mvp.py",
        "src/aie_decision/wave_authority.py"
      ]
    },
    {
      "task_id": "3.2",
      "status": "verified",
      "owned_files": [
        "src/aie_decision/wave_authority.py",
        "tests/test_wave_authority.py"
      ]
    },
    {
      "task_id": "3.3",
      "status": "verified",
      "owned_files": [
        "tests/test_wave_mvp_adversarial_review.py"
      ]
    },
    {
      "task_id": "4.1",
      "status": "implemented",
      "owned_files": [
        "schemas/wave_mvp_gate_evidence.schema.json",
        "scripts/validate_wave_mvp_gate_evidence.py",
        "tests/test_wave_mvp_gate_evidence.py",
        "docs/WAVE-MVP-GATE-EVIDENCE.md",
        "docs/wave_mvp_gate_evidence.current.json"
      ]
    },
    {
      "task_id": "4.2",
      "status": "verified",
      "owned_files": [
        "contracts/wave_mvp_adversarial_review_matrix.json",
        "tests/test_wave_mvp_adversarial_review.py"
      ]
    },
    {
      "task_id": "4.3",
      "status": "blocked",
      "blocker": "The explicit canonical beta.5 Code Intel run and native Sentrux ratchet pass. The convenience command still reports manifest reconciliation failure when no canonical integrations manifest is supplied, and the beta.5 lite session contract still writes native baseline.json instead of cache-only. These remain toolchain debt; the dirty user files are not owned by this change."
    }
  ],
  "status": "blocked",
  "focused_pytest": {
    "command": "uv run pytest tests/test_wave_mvp_gate_evidence.py tests/test_wave_contract_hardening.py tests/test_joint_wave_surface_mvp.py tests/test_wave_mvp_adversarial_review.py tests/test_wave_loop.py tests/test_joint_schema.py tests/test_factor_ir.py tests/test_particle_surface.py tests/test_wave_diagnostics.py tests/test_wave_authority.py tests/test_search.py tests/test_search_replay.py tests/test_candidate_generation.py -q",
    "passed": true
  },
  "full_pytest": {
    "command": "uv run pytest -q",
    "passed": true
  },
  "code_intel": {
    "command": "code-intel run execute --repo . --out <staging> --authority-root <authority> --final-name <run> --manifest C:\\Users\\Administrator\\AppData\\Local\\code-intel\\releases\\v0.7.0-beta.5\\orchestration\\integrations.json --doctor-require-repowise false",
    "outcome": "passed",
    "publication_path": "C:/Users/Administrator/AppData/Local/Temp/aie-code-intel-explicit-20260805034816798-out",
    "failure_detail": "The default code-intel . --mode normal convenience invocation remains domain_failed because this repository has no pipeline-owned orchestration/integrations.json; the explicit canonical beta.5 manifest run passed with domain and process failures empty."
  },
  "sentrux": {
    "command": "code-intel sentrux check .",
    "rules_passed": true,
    "ratchet_passed": true,
    "baseline_path": ".sentrux/baseline.json",
    "failure_detail": "Native Sentrux 2.2.0 rules and ratchet passed with no degradation: quality 8795 to 8795, coupling 60.51 to 60.51, cycles 0 to 0, god files 6 to 6."
  },
  "independent_review": {
    "reviewer": "independent-adversarial (ecc:code-reviewer + adversarial matrix)",
    "outcome": "approved",
    "evidence_path": "contracts/wave_mvp_adversarial_review_matrix.json",
    "findings": [
      "12/12 adversarial tests pass",
      "No pytest.skip paths or no-op fallbacks in acceptance path",
      "Authoritative evaluator path (wave_authority.py) with invocation provenance",
      "Fail-closed gate evidence schema and validator with 29 tests"
    ]
  },
  "commit": "da1e28b9e038d91fd2d15d3f80b9741a1be06111",
  "dirty_files": [
    "D agents/openai.yaml",
    "D references/input-contract.md",
    "D references/legacy-mode.md",
    "M schemas/acceptance-executable-case.schema.json",
    "M schemas/acceptance-interval-cohort.schema.json",
    "M src/aie_decision/__init__.py",
    "M tests/test_decomposition.py",
    "?? docs/wave_mvp_gate_evidence.current.json",
    "?? docs/WAVE-MVP-GATE-EVIDENCE.md"
  ],
  "provider": "deepseek",
  "model": "deepseek-v4-pro"
}
